[
        
            {
            "id": "e1",
            "day": "",
            "performerId": "p3",
            "venueId": "v1",
            "start": "22:00",
            "end": "23:30",
            "title": "Sleep Token Ritual"
            },
            {
            "id": "e2",
            "day": "",
            "performerId": "p5",
            "venueId": "v1",
            "start": "20:00",
            "end": "21:15",
            "title": "Deftones Live"
            },
            {
            "id": "e3",
            "day": "",
            "performerId": "p8",
            "venueId": "v1",
            "start": "18:30",
            "end": "19:30",
            "title": "Bad Omens Show"
            },
            {
            "id": "e4",
            "day": "",
            "performerId": "p11",
            "venueId": "v1",
            "start": "17:00",
            "end": "18:00",
            "title": "Placebo UK"
            },
            {
            "id": "e5",
            "day": "",
            "performerId": "p14",
            "venueId": "v1",
            "start": "15:30",
            "end": "16:30",
            "title": "Muse Preview"
            },
            {
            "id": "e6",
            "day": "",
            "performerId": "p20",
            "venueId": "v1",
            "start": "14:00",
            "end": "15:00",
            "title": "Alice in Chains Tribute"
            },
            {
            "id": "e7",
            "day": "",
            "performerId": "p21",
            "venueId": "v2",
            "start": "21:00",
            "end": "22:00",
            "title": "Loathe Atmosphere"
            },
            {
            "id": "e8",
            "day": "",
            "performerId": "p24",
            "venueId": "v2",
            "start": "19:30",
            "end": "20:30",
            "title": "Caspian Post-Rock"
            },
            {
            "id": "e9",
            "day": "",
            "performerId": "p27",
            "venueId": "v2",
            "start": "18:00",
            "end": "19:00",
            "title": "While She Sleeps"
            },
            {
            "id": "e10",
            "day": "",
            "performerId": "p30",
            "venueId": "v2",
            "start": "16:30",
            "end": "17:30",
            "title": "Seether Acoustic/Electric"
            },
            {
            "id": "e11",
            "day": "",
            "performerId": "p33",
            "venueId": "v2",
            "start": "15:00",
            "end": "16:00",
            "title": "Leprous Progressive"
            },
            {
            "id": "e12",
            "day": "",
            "performerId": "p36",
            "venueId": "v2",
            "start": "13:30",
            "end": "14:30",
            "title": "P.O.D. Classics"
            },
            {
            "id": "e13",
            "day": "",
            "performerId": "p39",
            "venueId": "v2",
            "start": "12:00",
            "end": "13:00",
            "title": "Turnstile Energy"
            },
            {
            "id": "e14",
            "day": "",
            "performerId": "p41",
            "venueId": "v3",
            "start": "22:30",
            "end": "23:30",
            "title": "Lorna Shore Chaos"
            },
            {
            "id": "e15",
            "day": "",
            "performerId": "p44",
            "venueId": "v3",
            "start": "21:00",
            "end": "22:00",
            "title": "Tallah Nu-core"
            },
            {
            "id": "e16",
            "day": "",
            "performerId": "p47",
            "venueId": "v3",
            "start": "19:30",
            "end": "20:30",
            "title": "Polaris Aus"
            },
            {
            "id": "e17",
            "day": "",
            "performerId": "p50",
            "venueId": "v3",
            "start": "18:00",
            "end": "19:00",
            "title": "HIM Love Metal"
            },
            {
            "id": "e18",
            "day": "",
            "performerId": "p53",
            "venueId": "v3",
            "start": "16:30",
            "end": "17:30",
            "title": "Scowl Hardcore"
            },
            {
            "id": "e19",
            "day": "",
            "performerId": "p56",
            "venueId": "v3",
            "start": "15:00",
            "end": "16:00",
            "title": "Landmvrks France"
            },
            {
            "id": "e20",
            "day": "",
            "performerId": "p59",
            "venueId": "v3",
            "start": "13:30",
            "end": "14:30",
            "title": "Mastodon Sludge"
            },
            {
            "id": "e21",
            "day": "",
            "performerId": "p2",
            "venueId": "v1",
            "start": "22:15",
            "end": "23:45",
            "title": "Korn: 20th Anniversary"
            },
            {
            "id": "e22",
            "day": "",
            "performerId": "p7",
            "venueId": "v1",
            "start": "20:15",
            "end": "21:30",
            "title": "Limp Bizkit Party"
            },
            {
            "id": "e23",
            "day": "",
            "performerId": "p9",
            "venueId": "v1",
            "start": "18:45",
            "end": "19:45",
            "title": "Spiritbox Live"
            },
            {
            "id": "e24",
            "day": "",
            "performerId": "p12",
            "venueId": "v1",
            "start": "17:15",
            "end": "18:15",
            "title": "Papa Roach Infest"
            },
            {
            "id": "e25",
            "day": "",
            "performerId": "p15",
            "venueId": "v1",
            "start": "15:45",
            "end": "16:45",
            "title": "QOTSA Desert Rock"
            },
            {
            "id": "e26",
            "day": "",
            "performerId": "p18",
            "venueId": "v1",
            "start": "14:15",
            "end": "15:15",
            "title": "Pendulum Drum&Bass"
            },
            {
            "id": "e27",
            "day": "",
            "performerId": "p22",
            "venueId": "v2",
            "start": "21:15",
            "end": "22:15",
            "title": "Knocked Loose Pit"
            },
            {
            "id": "e28",
            "day": "",
            "performerId": "p25",
            "venueId": "v2",
            "start": "19:45",
            "end": "20:45",
            "title": "Static-X Evil Disco"
            },
            {
            "id": "e29",
            "day": "",
            "performerId": "p28",
            "venueId": "v2",
            "start": "18:15",
            "end": "19:15",
            "title": "Idles UK"
            },
            {
            "id": "e30",
            "day": "",
            "performerId": "p31",
            "venueId": "v2",
            "start": "16:45",
            "end": "17:45",
            "title": "MCR Black Parade"
            },
            {
            "id": "e31",
            "day": "",
            "performerId": "p34",
            "venueId": "v2",
            "start": "15:15",
            "end": "16:15",
            "title": "Health Industrial"
            },
            {
            "id": "e32",
            "day": "",
            "performerId": "p37",
            "venueId": "v2",
            "start": "13:45",
            "end": "14:45",
            "title": "Highly Suspect"
            },
            {
            "id": "e33",
            "day": "",
            "performerId": "p40",
            "venueId": "v2",
            "start": "12:15",
            "end": "13:15",
            "title": "Cult of Luna Post-Metal"
            },
            {
            "id": "e34",
            "day": "",
            "performerId": "p42",
            "venueId": "v3",
            "start": "22:45",
            "end": "23:45",
            "title": "Yonaka Rocks"
            },
            {
            "id": "e35",
            "day": "",
            "performerId": "p45",
            "venueId": "v3",
            "start": "21:15",
            "end": "22:15",
            "title": "The Interrupters Punk"
            },
            {
            "id": "e36",
            "day": "",
            "performerId": "p48",
            "venueId": "v3",
            "start": "19:45",
            "end": "20:45",
            "title": "Vended Next Gen"
            },
            {
            "id": "e37",
            "day": "",
            "performerId": "p51",
            "venueId": "v3",
            "start": "18:15",
            "end": "19:15",
            "title": "Motionless In White Live"
            },
            {
            "id": "e38",
            "day": "",
            "performerId": "p54",
            "venueId": "v3",
            "start": "16:45",
            "end": "17:45",
            "title": "Wallows Indie"
            },
            {
            "id": "e39",
            "day": "",
            "performerId": "p57",
            "venueId": "v3",
            "start": "15:15",
            "end": "16:15",
            "title": "Dead Pony Energy"
            },
            {
            "id": "e40",
            "day": "",
            "performerId": "p60",
            "venueId": "v3",
            "start": "13:45",
            "end": "14:45",
            "title": "Russian Circles"
            },
            {
            "id": "e41",
            "day": "",
            "performerId": "p1",
            "venueId": "v1",
            "start": "22:00",
            "end": "23:59",
            "title": "Linkin Park: From Zero"
            },
            {
            "id": "e42",
            "day": "",
            "performerId": "p4",
            "venueId": "v1",
            "start": "20:00",
            "end": "21:30",
            "title": "BMTH Post Human"